<?xml version="1.0" encoding="UTF-8"?>
<Product xmlns:xsi="http://www.w3.org/2001/XMLSchema-instance" xsi:noNamespaceSchemaLocation="ProductSchema.xsd">
  <Id>idvalue0</Id>
  <LOB>LOB</LOB>
  <Program>Program</Program>
  <State>State</State>
  <Title>Title</Title>
  <NewBusinessEffectiveDate>2001-12-31T12:00:00</NewBusinessEffectiveDate>
  <NewBusinessExpirationDate>2001-12-31T12:00:00</NewBusinessExpirationDate>
  <RenewalEffectiveDate>2001-12-31T12:00:00</RenewalEffectiveDate>
  <RenewalExpirationDate>2001-12-31T12:00:00</RenewalExpirationDate>
  <RateTable>
    <Id>idvalue1</Id>
    <Name>Name</Name>
    <Title>Title</Title>
    <Overridden>true</Overridden>
    <BureauRuleNumber>BureauRuleNumber</BureauRuleNumber>
    <RateTableConfiguration>
      <Id>idvalue2</Id>
      <ConfigurationType>ConfigurationType</ConfigurationType>
      <Sequence>0</Sequence>
      <Name>Name</Name>
      <LookupType>LookupType</LookupType>
      <Type>Type</Type>
      <Description>Description</Description>
      <Size>0</Size>
      <Scale>0</Scale>
    </RateTableConfiguration>
    <RateTableEntry>
      <Id>idvalue3</Id>
      <Sequence>0</Sequence>
      <Status>Status</Status>
      <Column1>Column1</Column1>
      <Column2>Column2</Column2>
      <Column3>Column3</Column3>
      <Column4>Column4</Column4>
      <Column5>Column5</Column5>
      <Column6>Column6</Column6>
      <Column7>Column7</Column7>
      <Column8>Column8</Column8>
      <Column9>Column9</Column9>
      <Column10>Column10</Column10>
      <NColumn1>0.0</NColumn1>
      <NColumn2>0.0</NColumn2>
      <NColumn3>0.0</NColumn3>
      <NColumn4>0.0</NColumn4>
      <NColumn5>0.0</NColumn5>
      <NColumn6>0.0</NColumn6>
      <NColumn7>0.0</NColumn7>
      <NColumn8>0.0</NColumn8>
      <NColumn9>0.0</NColumn9>
      <NColumn10>0.0</NColumn10>
      <ReturnValue>ReturnValue</ReturnValue>
      <ReturnNValue>0.0</ReturnNValue>
    </RateTableEntry>
  </RateTable>
  <DomainTable>
    <Id>idvalue4</Id>
    <Name>Name</Name>
    <Title>Title</Title>
    <Type>Type</Type>
    <Overridden>true</Overridden>
    <BureauRuleNumber>BureauRuleNumber</BureauRuleNumber>
    <DomainTableConfiguration>
      <Id>idvalue5</Id>
      <ConfigurationType>ConfigurationType</ConfigurationType>
      <Sequence>0</Sequence>
      <Name>Name</Name>
      <LookupType>LookupType</LookupType>
      <Type>Type</Type>
      <Description>Description</Description>
      <size>0</size>
      <Scale>0</Scale>
    </DomainTableConfiguration>
    <DomainTableEntry>
      <Id>idvalue6</Id>
      <Sequence>0</Sequence>
      <Status>Status</Status>
      <Column1>Column1</Column1>
      <Column2>Column2</Column2>
      <Column3>Column3</Column3>
      <Column4>Column4</Column4>
      <Column5>Column5</Column5>
      <Column6>Column6</Column6>
      <Column7>Column7</Column7>
      <Column8>Column8</Column8>
      <Column9>Column9</Column9>
      <Column10>Column10</Column10>
      <NColumn1>0.0</NColumn1>
      <NColumn2>0.0</NColumn2>
      <NColumn3>0.0</NColumn3>
      <NColumn4>0.0</NColumn4>
      <NColumn5>0.0</NColumn5>
      <NColumn6>0.0</NColumn6>
      <NColumn7>0.0</NColumn7>
      <NColumn8>0.0</NColumn8>
      <NColumn9>0.0</NColumn9>
      <NColumn10>0.0</NColumn10>
      <Code>Code</Code>
      <Description>Description</Description>
      <MinValue>0.0</MinValue>
      <MaxValue>0.0</MaxValue>
    </DomainTableEntry>
  </DomainTable>
  <RatingEntity>
    <Id>idvalue7</Id>
    <Name>Name</Name>
    <Product>idvalue0</Product>
    <RatingProcess>
      <Id>idvalue8</Id>
      <Name>Name</Name>
      <RatingEntity>idvalue0</RatingEntity>
      <ExecutionOrder>0</ExecutionOrder>
      <Product>idvalue0</Product>
      <ProcessStep>
        <Id>idvalue9</Id>
        <ExecutionOrder>0</ExecutionOrder>
        <Block>Block</Block>
        <Product>idvalue0</Product>
        <RatingProcess>idvalue0</RatingProcess>
        <RatingProgram>idvalue0</RatingProgram>
      </ProcessStep>
      <RatingProgram>
        <Id>idvalue10</Id>
        <Name>Name</Name>
        <ExecutionOrder>0</ExecutionOrder>
        <Product>idvalue0</Product>
        <RatingProcess>idvalue0</RatingProcess>
        <ProgramStep>
          <Id>idvalue11</Id>
          <ExecutionOrder>0</ExecutionOrder>
          <Block>Block</Block>
          <Product>idvalue0</Product>
          <RatingProcess>idvalue0</RatingProcess>
          <RatingProgram>idvalue0</RatingProgram>
        </ProgramStep>
      </RatingProgram>
    </RatingProcess>
  </RatingEntity>
</Product>
